,Name of movie,Year of relase,Watchtime,Movie Rating,Metascore,Votes,Gross collection,Description,Director,Star
0,The Shawshank Redemption,1994,142,9.3,82,"2,766,234",$28.34M,"Over the course of several years, two convicts form a friendship, seeking consolation and, eventually, redemption through basic compassion.",Frank Darabont,"['Tim Robbins', 'Morgan Freeman', 'Bob Gunton', 'William Sadler']"
1,The Godfather,1972,175,9.2,100,"1,925,242",$134.97M,"Don Vito Corleone, head of a mafia family, decides to hand over his empire to his youngest son Michael. However, his decision unintentionally puts the lives of his loved ones in grave danger.",Francis Ford Coppola,"['Marlon Brando', 'Al Pacino', 'James Caan', 'Diane Keaton']"
2,The Dark Knight,2008,152,9.0,84,"2,739,653",$534.86M,"When the menace known as the Joker wreaks havoc and chaos on the people of Gotham, Batman must accept one of the greatest psychological and physical tests of his ability to fight injustice.",Christopher Nolan,"['Christian Bale', 'Heath Ledger', 'Aaron Eckhart', 'Michael Caine']"
3,Schindler's List,1993,195,9.0,95,"1,393,356",$96.90M,"In German-occupied Poland during World War II, industrialist Oskar Schindler gradually becomes concerned for his Jewish workforce after witnessing their persecution by the Nazis.",Steven Spielberg,"['Liam Neeson', 'Ralph Fiennes', 'Ben Kingsley', 'Caroline Goodall']"
4,12 Angry Men,1957,96,9.0,97,"820,145",$4.36M,The jury in a New York City murder trial is frustrated by a single member whose skeptical caution forces them to more carefully consider the evidence before jumping to a hasty verdict.,Sidney Lumet,"['Henry Fonda', 'Lee J. Cobb', 'Martin Balsam', 'John Fiedler']"
5,The Lord of the Rings: The Return of the King,2003,201,9.0,94,"1,898,306",$377.85M,Gandalf and Aragorn lead the World of Men against Sauron's army to draw his gaze from Frodo and Sam as they approach Mount Doom with the One Ring.,Peter Jackson,"['Elijah Wood', 'Viggo Mortensen', 'Ian McKellen', 'Orlando Bloom']"
6,The Godfather Part II,1974,202,9.0,90,"1,309,872",$57.30M,"The early life and career of Vito Corleone in 1920s New York City is portrayed, while his son, Michael, expands and tightens his grip on the family crime syndicate.",Francis Ford Coppola,"['Al Pacino', 'Robert De Niro', 'Robert Duvall', 'Diane Keaton']"
7,Spider-Man: Across the Spider-Verse,2023,140,8.9,86,"183,248",#14,"Miles Morales catapults across the Multiverse, where he encounters a team of Spider-People charged with protecting its very existence. When the heroes clash on how to handle a new threat, Miles must redefine what it means to be a hero.","Directors:Joaquim Dos Santos, Kemp Powers, Justin K. Thompson","['Shameik Moore', 'Hailee Steinfeld', 'Brian Tyree Henry', 'Luna Lauren Velez']"
8,Pulp Fiction,1994,154,8.9,95,"2,123,634",$107.93M,"The lives of two mob hitmen, a boxer, a gangster and his wife, and a pair of diner bandits intertwine in four tales of violence and redemption.",Quentin Tarantino,"['John Travolta', 'Uma Thurman', 'Samuel L. Jackson', 'Bruce Willis']"
9,Inception,2010,148,8.8,74,"2,431,141",$292.58M,"A thief who steals corporate secrets through the use of dream-sharing technology is given the inverse task of planting an idea into the mind of a C.E.O., but his tragic past may doom the project and his team to disaster.",Christopher Nolan,"['Leonardo DiCaprio', 'Joseph Gordon-Levitt', 'Elliot Page', 'Ken Watanabe']"
10,Forrest Gump,1994,142,8.8,82,"2,151,666",$330.25M,"The history of the United States from the 1950s to the '70s unfolds from the perspective of an Alabama man with an IQ of 75, who yearns to be reunited with his childhood sweetheart.",Robert Zemeckis,"['Tom Hanks', 'Robin Wright', 'Gary Sinise', 'Sally Field']"
11,The Lord of the Rings: The Fellowship of the Ring,2001,178,8.8,92,"1,926,734",$315.54M,A meek Hobbit from the Shire and eight companions set out on a journey to destroy the powerful One Ring and save Middle-earth from the Dark Lord Sauron.,Peter Jackson,"['Elijah Wood', 'Ian McKellen', 'Orlando Bloom', 'Sean Bean']"
12,Fight Club,1999,139,8.8,67,"2,202,929",$37.03M,An insomniac office worker and a devil-may-care soap maker form an underground fight club that evolves into much more.,David Fincher,"['Brad Pitt', 'Edward Norton', 'Meat Loaf', 'Zach Grenier']"
13,"Il buono, il brutto, il cattivo",1966,161,8.8,90,"781,942",$6.10M,A bounty hunting scam joins two men in an uneasy alliance against a third in a race to find a fortune in gold buried in a remote cemetery.,Sergio Leone,"['Clint Eastwood', 'Eli Wallach', 'Lee Van Cleef', 'Aldo Giuffrè']"
14,The Lord of the Rings: The Two Towers,2002,179,8.8,87,"1,713,140",$342.55M,"While Frodo and Sam edge closer to Mordor with the help of the shifty Gollum, the divided fellowship makes a stand against Sauron's new ally, Saruman, and his hordes of Isengard.",Peter Jackson,"['Elijah Wood', 'Ian McKellen', 'Viggo Mortensen', 'Orlando Bloom']"
15,Jai Bhim,2021,164,8.8,NO Score,"208,169",#218,"When a tribal man is arrested for a case of alleged theft, his wife turns to a human-rights lawyer to help bring justice.",T.J. Gnanavel,"['Suriya', 'Lijo Mol Jose', 'Manikandan K.', 'Rajisha Vijayan']"
16,777 Charlie,2022,136,8.8,NO Score,"35,586",No count,Dharma is stuck in a rut with his negative and lonely lifestyle and spends each day in the comfort of his loneliness. A pup named Charlie enters his life and gives him a new perspective towards it.,Kiranraj K,"['Rakshit Shetty', 'Charlie', 'Sangeetha Sringeri', 'Raj B. Shetty']"
17,Interstellar,2014,169,8.7,74,"1,936,613",$188.02M,"When Earth becomes uninhabitable in the future, a farmer and ex-NASA pilot, Joseph Cooper, is tasked to pilot a spacecraft, along with a team of researchers, to find a new planet for humans.",Christopher Nolan,"['Matthew McConaughey', 'Anne Hathaway', 'Jessica Chastain', 'Mackenzie Foy']"
18,One Flew Over the Cuckoo's Nest,1975,133,8.7,84,"1,034,364",$112.00M,"In the Fall of 1963, a Korean War veteran and criminal pleads insanity and is admitted to a mental institution, where he rallies up the scared patients against the tyrannical nurse.",Milos Forman,"['Jack Nicholson', 'Louise Fletcher', 'Michael Berryman', 'Peter Brocco']"
19,GoodFellas,1990,145,8.7,92,"1,200,637",$46.84M,"The story of Henry Hill and his life in the mafia, covering his relationship with his wife Karen and his mob partners Jimmy Conway and Tommy DeVito.",Martin Scorsese,"['Robert De Niro', 'Ray Liotta', 'Joe Pesci', 'Lorraine Bracco']"
20,The Matrix,1999,136,8.7,73,"1,970,436",$171.48M,"When a beautiful stranger leads computer hacker Neo to a forbidding underworld, he discovers the shocking truth--the life he knows is the elaborate deception of an evil cyber-intelligence.","Directors:Lana Wachowski, Lilly Wachowski","['Keanu Reeves', 'Laurence Fishburne', 'Carrie-Anne Moss', 'Hugo Weaving']"
21,Star Wars: Episode V - The Empire Strikes Back,1980,124,8.7,82,"1,329,373",$290.48M,"After the Rebels are overpowered by the Empire, Luke Skywalker begins his Jedi training with Yoda, while his friends are pursued across the galaxy by Darth Vader and bounty hunter Boba Fett.",Irvin Kershner,"['Mark Hamill', 'Harrison Ford', 'Carrie Fisher', 'Billy Dee Williams']"
22,Rocketry: The Nambi Effect,2022,157,8.7,NO Score,"54,216",No count,"Based on the life of Indian Space Research Organization scientist Nambi Narayanan, who was framed for being a spy and arrested in 1994. Though free, he continues to fight for justice against the officials who falsely implicated him.",Madhavan,"['Madhavan', 'Simran', 'Rajit Kapoor', 'Ravi Raghavendra']"
23,Soorarai Pottru,2020,153,8.7,NO Score,"119,997",No count,"Nedumaaran Rajangam ""Maara"" sets out to make the common man fly and in the process takes on the world's most capital intensive industry and several enemies who stand in his way.",Sudha Kongara,"['Suriya', 'Paresh Rawal', 'Aparna Balamurali', 'Urvashi']"
24,Saving Private Ryan,1998,169,8.6,91,"1,433,088",$216.54M,"Following the Normandy Landings, a group of U.S. soldiers go behind enemy lines to retrieve a paratrooper whose brothers have been killed in action.",Steven Spielberg,"['Tom Hanks', 'Matt Damon', 'Tom Sizemore', 'Edward Burns']"
25,Terminator 2: Judgment Day,1991,137,8.6,75,"1,130,652",$204.84M,"A cyborg, identical to the one who failed to kill Sarah Connor, must now protect her ten year old son John from an even more advanced and powerful cyborg.",James Cameron,"['Arnold Schwarzenegger', 'Linda Hamilton', 'Edward Furlong', 'Robert Patrick']"
26,Se7en,1995,127,8.6,65,"1,710,698",$100.13M,"Two detectives, a rookie and a veteran, hunt a serial killer who uses the seven deadly sins as his motives.",David Fincher,"['Morgan Freeman', 'Brad Pitt', 'Kevin Spacey', 'Andrew Kevin Walker']"
27,The Silence of the Lambs,1991,118,8.6,86,"1,477,061",$130.74M,"A young F.B.I. cadet must receive the help of an incarcerated and manipulative cannibal killer to help catch another serial killer, a madman who skins his victims.",Jonathan Demme,"['Jodie Foster', 'Anthony Hopkins', 'Lawrence A. Bonney', 'Kasi Lemmons']"
28,The Green Mile,1999,189,8.6,61,"1,344,977",$136.80M,"A tale set on death row in a Southern jail, where gentle giant John possesses the mysterious power to heal people's ailments. When the lead guard, Paul, recognizes John's gift, he tries to help stave off the condemned man's execution.",Frank Darabont,"['Tom Hanks', 'Michael Clarke Duncan', 'David Morse', 'Bonnie Hunt']"
29,Star Wars,1977,121,8.6,90,"1,401,609",$322.74M,"Luke Skywalker joins forces with a Jedi Knight, a cocky pilot, a Wookiee and two droids to save the galaxy from the Empire's world-destroying battle station, while also attempting to rescue Princess Leia from the mysterious Darth Vader.",George Lucas,"['Mark Hamill', 'Harrison Ford', 'Carrie Fisher', 'Alec Guinness']"
30,Sen to Chihiro no kamikakushi,2001,125,8.6,96,"797,628",$10.06M,"During her family's move to the suburbs, a sullen 10-year-old girl wanders into a world ruled by gods, witches and spirits, a world where humans are changed into beasts.",Hayao Miyazaki,"['Daveigh Chase', 'Suzanne Pleshette', 'Miyu Irino', 'Rumi Hiiragi']"
31,Cidade de Deus,2002,130,8.6,79,"774,945",$7.56M,"In the slums of Rio, two kids' paths diverge as one struggles to become a photographer and the other a kingpin.","Directors:Fernando Meirelles, Kátia Lund","['Alexandre Rodrigues', 'Leandro Firmino', 'Matheus Nachtergaele', 'Phellipe Haagensen']"
32,La vita è bella,1997,116,8.6,59,"715,224",$57.60M,"When an open-minded Jewish waiter and his son become victims of the Holocaust, he uses a perfect mixture of will, humor and imagination to protect his son from the dangers around their camp.",Roberto Benigni,"['Roberto Benigni', 'Nicoletta Braschi', 'Giorgio Cantarini', 'Giustino Durano']"
33,It's a Wonderful Life,1946,130,8.6,89,"474,841",#21,An angel is sent from Heaven to help a desperately frustrated businessman by showing him what life would have been like if he had never existed.,Frank Capra,"['James Stewart', 'Donna Reed', 'Lionel Barrymore', 'Thomas Mitchell']"
34,Shichinin no samurai,1954,207,8.6,98,"354,831",$0.27M,"Farmers from a village exploited by bandits hire a veteran samurai for protection, who gathers six other samurai to join him.",Akira Kurosawa,"['Toshirô Mifune', 'Takashi Shimura', 'Keiko Tsushima', 'Yukiko Shimazaki']"
35,Seppuku,1962,133,8.6,85,"62,058",#46,"When a ronin requesting seppuku at a feudal lord's palace is told of the brutal suicide of another ronin who previously visited, he reveals how their pasts are intertwined - and in doing so challenges the clan's integrity.",Masaki Kobayashi,"['Tatsuya Nakadai', 'Akira Ishihama', 'Shima Iwashita', 'Tetsurô Tanba']"
36,Sita Ramam,2022,163,8.6,NO Score,"61,380",No count,"An orphan soldier, Lieutenant Ram's life changes, after he gets a letter from a girl named Sita. He meets her and love blossoms between them. When he comes back to his camp in Kashmir,After he gets caught in jail, he sends a letter to Sita which won't reach her.",Hanu Raghavapudi,"['Dulquer Salmaan', 'Mrunal Thakur', 'Rashmika Mandanna', 'Sumanth']"
37,Alien,1979,117,8.5,89,"909,377",$78.90M,The crew of a commercial spacecraft encounters a deadly lifeform after investigating an unknown transmission.,Ridley Scott,"['Sigourney Weaver', 'Tom Skerritt', 'John Hurt', 'Veronica Cartwright']"
38,Back to the Future,1985,116,8.5,87,"1,248,854",$210.61M,"Marty McFly, a 17-year-old high school student, is accidentally sent 30 years into the past in a time-traveling DeLorean invented by his close friend, the maverick scientist Doc Brown.",Robert Zemeckis,"['Michael J. Fox', 'Christopher Lloyd', 'Lea Thompson', 'Crispin Glover']"
39,The Departed,2006,151,8.5,85,"1,365,265",$132.38M,An undercover cop and a mole in the police attempt to identify each other while infiltrating an Irish gang in South Boston.,Martin Scorsese,"['Leonardo DiCaprio', 'Matt Damon', 'Jack Nicholson', 'Mark Wahlberg']"
40,Gladiator,2000,155,8.5,67,"1,545,600",$187.71M,A former Roman General sets out to exact vengeance against the corrupt emperor who murdered his family and sent him into slavery.,Ridley Scott,"['Russell Crowe', 'Joaquin Phoenix', 'Connie Nielsen', 'Oliver Reed']"
41,The Prestige,2006,130,8.5,66,"1,374,003",$53.09M,"After a tragic accident, two stage magicians in 1890s London engage in a battle to create the ultimate illusion while sacrificing everything they have to outwit each other.",Christopher Nolan,"['Christian Bale', 'Hugh Jackman', 'Scarlett Johansson', 'Michael Caine']"
42,Gisaengchung,2019,132,8.5,96,"867,176",$53.37M,Greed and class discrimination threaten the newly formed symbiotic relationship between the wealthy Park family and the destitute Kim clan.,Bong Joon Ho,"['Song Kang-ho', 'Lee Sun-kyun', 'Cho Yeo-jeong', 'Choi Woo-sik']"
43,Whiplash,2014,106,8.5,89,"915,004",$13.09M,A promising young drummer enrolls at a cut-throat music conservatory where his dreams of greatness are mentored by an instructor who will stop at nothing to realize a student's potential.,Damien Chazelle,"['Miles Teller', 'J.K. Simmons', 'Melissa Benoist', 'Paul Reiser']"
44,Léon,1994,110,8.5,64,"1,196,955",$19.50M,"12-year-old Mathilda is reluctantly taken in by Léon, a professional assassin, after her family is murdered. An unusual relationship forms as she becomes his protégée and learns the assassin's trade.",Luc Besson,"['Jean Reno', 'Gary Oldman', 'Natalie Portman', 'Danny Aiello']"
45,Casablanca,1942,102,8.5,100,"586,935",$1.02M,A cynical expatriate American cafe owner struggles to decide whether or not to help his former lover and her fugitive husband escape the Nazis in French Morocco.,Michael Curtiz,"['Humphrey Bogart', 'Ingrid Bergman', 'Paul Henreid', 'Claude Rains']"
46,The Usual Suspects,1995,106,8.5,77,"1,109,765",$23.34M,The sole survivor of a pier shoot-out tells the story of how a notorious criminal influenced the events that began with five criminals meeting in a seemingly random police lineup.,Bryan Singer,"['Kevin Spacey', 'Gabriel Byrne', 'Chazz Palminteri', 'Stephen Baldwin']"
47,The Lion King,1994,88,8.5,88,"1,093,370",$422.78M,"Lion prince Simba and his father are targeted by his bitter uncle, who wants to ascend the throne himself.","Directors:Roger Allers, Rob Minkoff","['Matthew Broderick', 'Jeremy Irons', 'James Earl Jones', 'Whoopi Goldberg']"
48,American History X,1998,119,8.5,62,"1,148,922",$6.72M,"Living a life marked by violence, neo-Nazi Derek finally goes to prison after killing two black youths. Upon his release, Derek vows to change; he hopes to prevent his brother, Danny, who idolizes Derek, from following in his footsteps.",Tony Kaye,"['Edward Norton', 'Edward Furlong', ""Beverly D'Angelo"", 'Jennifer Lien']"
49,The Pianist,2002,150,8.5,85,"862,879",$32.57M,A Polish Jewish musician struggles to survive the destruction of the Warsaw ghetto of World War II.,Roman Polanski,"['Adrien Brody', 'Thomas Kretschmann', 'Frank Finlay', 'Emilia Fox']"
50,Psycho,1960,109,8.5,97,"691,858",$32.00M,"A Phoenix secretary embezzles $40,000 from her employer's client, goes on the run and checks into a remote motel run by a young man under the domination of his mother.",Alfred Hitchcock,"['Anthony Perkins', 'Janet Leigh', 'Vera Miles', 'John Gavin']"
51,The Intouchables,2011,112,8.5,57,"887,338",$13.18M,"After he becomes a quadriplegic from a paragliding accident, an aristocrat hires a young man from the projects to be his caregiver.","Directors:Olivier Nakache, Éric Toledano","['François Cluzet', 'Omar Sy', 'Anne Le Ny', 'Audrey Fleurot']"
52,Once Upon a Time in the West,1968,165,8.5,82,"338,915",$5.32M,A mysterious stranger with a harmonica joins forces with a notorious desperado to protect a beautiful widow from a ruthless assassin working for the railroad.,Sergio Leone,"['Henry Fonda', 'Charles Bronson', 'Claudia Cardinale', 'Jason Robards']"
53,Hotaru no haka,1988,89,8.5,94,"290,245",#45,A young boy and his little sister struggle to survive in Japan during World War II.,Isao Takahata,"['Tsutomu Tatsumi', 'Ayano Shiraishi', 'Akemi Yamaguchi', 'Yoshiko Shinohara']"
54,Rear Window,1954,112,8.5,100,"504,612",$36.76M,"A photographer in a wheelchair spies on his neighbors from his Greenwich Village courtyard apartment window, and becomes convinced one of them has committed murder, despite the skepticism of his fashion-model girlfriend.",Alfred Hitchcock,"['James Stewart', 'Grace Kelly', 'Wendell Corey', 'Thelma Ritter']"
55,Nuovo Cinema Paradiso,1988,155,8.5,80,"270,400",$11.99M,A filmmaker recalls his childhood when falling in love with the pictures at the cinema of his home village and forms a deep friendship with the cinema's projectionist.,Giuseppe Tornatore,"['Philippe Noiret', 'Enzo Cannavale', 'Antonella Attili', 'Isa Danieli']"
56,Modern Times,1936,87,8.5,96,"249,920",$0.16M,The Tramp struggles to live in modern industrial society with the help of a young homeless woman.,Charles Chaplin,"['Charles Chaplin', 'Paulette Goddard', 'Henry Bergman', 'Tiny Sandford']"
57,City Lights,1931,87,8.5,99,"189,585",$0.02M,"With the aid of a wealthy erratic tippler, a dewy-eyed tramp who has fallen in love with a sightless flower girl accumulates money to be able to help her medically.",Charles Chaplin,"['Charles Chaplin', 'Virginia Cherrill', 'Florence Lee', 'Harry Myers']"
58,96,II 2018,158,8.5,NO Score,"33,494",No count,Two high school sweethearts meet at a reunion after 22 years and reminisce about their past.,C. Prem Kumar,"['Vijay Sethupathi', 'Adithya Bhaskar', 'Trisha Krishnan', 'Gouri Kishan']"
59,Raiders of the Lost Ark,1981,115,8.4,85,"1,002,626",$248.16M,"In 1936, archaeologist and adventurer Indiana Jones is hired by the U.S. government to find the Ark of the Covenant before the Nazis can obtain its awesome powers.",Steven Spielberg,"['Harrison Ford', 'Karen Allen', 'Paul Freeman', 'John Rhys-Davies']"
60,Spider-Man: Into the Spider-Verse,2018,117,8.4,87,"608,070",$190.24M,Teen Miles Morales becomes the Spider-Man of his universe and must join with five spider-powered individuals from other dimensions to stop a threat for all realities.,"Directors:Bob Persichetti, Peter Ramsey, Rodney Rothman","['Shameik Moore', 'Jake Johnson', 'Hailee Steinfeld', 'Mahershala Ali']"
61,Aliens,1986,137,8.4,84,"736,756",$85.16M,"Decades after surviving the Nostromo incident, Ellen Ripley is sent out to re-establish contact with a terraforming colony but finds herself battling the Alien Queen and her offspring.",James Cameron,"['Sigourney Weaver', 'Michael Biehn', 'Carrie Henn', 'Paul Reiser']"
62,Avengers: Endgame,2019,181,8.4,78,"1,193,934",$858.37M,"After the devastating events of Avengers: Infinity War (2018), the universe is in ruins. With the help of remaining allies, the Avengers assemble once more in order to reverse Thanos' actions and restore balance to the universe.","Directors:Anthony Russo, Joe Russo","['Robert Downey Jr.', 'Chris Evans', 'Mark Ruffalo', 'Chris Hemsworth']"
63,Django Unchained,2012,165,8.4,81,"1,612,484",$162.81M,"With the help of a German bounty-hunter, a freed slave sets out to rescue his wife from a brutal plantation owner in Mississippi.",Quentin Tarantino,"['Jamie Foxx', 'Christoph Waltz', 'Leonardo DiCaprio', 'Kerry Washington']"
64,The Shining,1980,146,8.4,66,"1,056,712",$44.02M,"A family heads to an isolated hotel for the winter where a sinister presence influences the father into violence, while his psychic son sees horrific forebodings from both past and future.",Stanley Kubrick,"['Jack Nicholson', 'Shelley Duvall', 'Danny Lloyd', 'Scatman Crothers']"
65,Oldeuboi,2003,101,8.4,77,"601,192",$0.71M,"After being kidnapped and imprisoned for fifteen years, Oh Dae-Su is released, only to find that he must find his captor in five days.",Park Chan-wook,"['Choi Min-sik', 'Yoo Ji-tae', 'Kang Hye-jeong', 'Kim Byeong-Ok']"
66,Joker,I 2019,122,8.4,59,"1,371,144",$335.45M,"The rise of Arthur Fleck, from aspiring stand-up comedian and pariah to Gotham's clown prince and leader of the revolution.",Todd Phillips,"['Joaquin Phoenix', 'Robert De Niro', 'Zazie Beetz', 'Frances Conroy']"
67,The Dark Knight Rises,2012,164,8.4,78,"1,753,441",$448.14M,"Eight years after the Joker's reign of chaos, Batman is coerced out of exile with the assistance of the mysterious Selina Kyle in order to defend Gotham City from the vicious guerrilla terrorist Bane.",Christopher Nolan,"['Christian Bale', 'Tom Hardy', 'Anne Hathaway', 'Gary Oldman']"
68,Idi i smotri,1985,142,8.4,NO Score,"87,557",#91,"After finding an old rifle, a young boy joins the Soviet resistance movement against ruthless German forces and experiences the horrors of World War II.",Elem Klimov,"['Aleksey Kravchenko', 'Olga Mironova', 'Liubomiras Laucevicius', 'Vladas Bagdonas']"
69,Apocalypse Now,1979,147,8.4,94,"685,872",$83.47M,A U.S. Army officer serving in Vietnam is tasked with assassinating a renegade Special Forces Colonel who sees himself as a god.,Francis Ford Coppola,"['Martin Sheen', 'Marlon Brando', 'Robert Duvall', 'Frederic Forrest']"
70,Amadeus,1984,160,8.4,88,"412,219",$51.97M,"The life, success and troubles of Wolfgang Amadeus Mozart, as told by Antonio Salieri, the contemporaneous composer who was deeply jealous of Mozart's talent and claimed to have murdered him.",Milos Forman,"['F. Murray Abraham', 'Tom Hulce', 'Elizabeth Berridge', 'Roy Dotrice']"
71,Memento,2000,113,8.4,83,"1,270,991",$25.54M,A man with short-term memory loss attempts to track down his wife's murderer.,Christopher Nolan,"['Guy Pearce', 'Carrie-Anne Moss', 'Joe Pantoliano', 'Mark Boone Junior']"
72,Avengers: Infinity War,2018,149,8.4,68,"1,136,320",$678.82M,The Avengers and their allies must be willing to sacrifice all in an attempt to defeat the powerful Thanos before his blitz of devastation and ruin puts an end to the universe.,"Directors:Anthony Russo, Joe Russo","['Robert Downey Jr.', 'Chris Hemsworth', 'Mark Ruffalo', 'Chris Evans']"
73,Coco,I 2017,105,8.4,81,"542,492",$209.73M,"Aspiring musician Miguel, confronted with his family's ancestral ban on music, enters the Land of the Dead to find his great-great-grandfather, a legendary singer.","Directors:Lee Unkrich, Adrian Molina","['Anthony Gonzalez', 'Gael García Bernal', 'Benjamin Bratt', 'Alanna Ubach']"
74,Kimi no na wa.,2016,106,8.4,81,"291,582",$5.02M,"Two teenagers share a profound, magical connection upon discovering they are swapping bodies. Things manage to become even more complicated when the boy and girl decide to meet in person.",Makoto Shinkai,"['Ryunosuke Kamiki', 'Mone Kamishiraishi', 'Ryo Narita', 'Aoi Yûki']"
75,WALL·E,2008,98,8.4,95,"1,151,477",$223.81M,"In the distant future, a small waste-collecting robot inadvertently embarks on a space journey that will ultimately decide the fate of mankind.",Andrew Stanton,"['Ben Burtt', 'Elissa Knight', 'Jeff Garlin', 'Fred Willard']"
76,3 Idiots,2009,170,8.4,67,"413,620",$6.53M,"Two friends are searching for their long lost companion. They revisit their college days and recall the memories of their friend who inspired them to think differently, even as the rest of the world called them ""idiots"".",Rajkumar Hirani,"['Aamir Khan', 'Madhavan', 'Mona Singh', 'Sharman Joshi']"
77,The Lives of Others,2006,137,8.4,89,"398,365",$11.29M,"In 1984 East Berlin, an agent of the secret police, conducting surveillance on a writer and his lover, finds himself becoming increasingly absorbed by their lives.",Florian Henckel von Donnersmarck,"['Ulrich Mühe', 'Martina Gedeck', 'Sebastian Koch', 'Ulrich Tukur']"
78,Dr. Strangelove or: How I Learned to Stop Worrying and Love the Bomb,1964,95,8.4,97,"502,708",$0.28M,"An insane American general orders a bombing attack on the Soviet Union, triggering a path to nuclear holocaust that a war room full of politicians and generals frantically tries to stop.",Stanley Kubrick,"['Peter Sellers', 'George C. Scott', 'Sterling Hayden', 'Keenan Wynn']"
79,Capharnaüm,2018,126,8.4,75,"96,620",$1.66M,"While serving a five-year sentence for a violent crime, a 12-year-old boy sues his parents for neglect.",Nadine Labaki,"['Zain Al Rafeea', 'Yordanos Shiferaw', 'Boluwatife Treasure Bankole', 'Kawsar Al Haddad']"
80,Das Boot,1981,149,8.4,86,"256,879",$11.49M,A German U-boat stalks the frigid waters of the North Atlantic as its young crew experience the sheer terror and claustrophobic life of a submariner in World War II.,Wolfgang Petersen,"['Jürgen Prochnow', 'Herbert Grönemeyer', 'Klaus Wennemann', 'Hubertus Bengsch']"
81,Sunset Blvd.,1950,110,8.4,94,"228,368",#60,A screenwriter develops a dangerous relationship with a faded film star determined to make a triumphant return.,Billy Wilder,"['William Holden', 'Gloria Swanson', 'Erich von Stroheim', 'Nancy Olson']"
