,Name of movie,Year of relase,Watchtime,Movie Rating,Metascore,Votes,Gross collection,Description,Director,Star
82,Paths of Glory,1957,88,8.4,90,"203,584",#61,"After refusing to attack an enemy position, a general accuses the soldiers of cowardice and their commanding officer must defend them.",Stanley Kubrick,"['Kirk Douglas', 'Ralph Meeker', 'Adolphe Menjou', 'George Macready']"
83,Witness for the Prosecution,1957,116,8.4,76,"130,616",$8.18M,A veteran British barrister must defend his client in a murder trial that has surprise after surprise.,Billy Wilder,"['Tyrone Power', 'Marlene Dietrich', 'Charles Laughton', 'Elsa Lanchester']"
84,The Great Dictator,1940,125,8.4,NO Score,"229,945",$0.29M,Dictator Adenoid Hynkel tries to expand his empire while a poor Jewish barber tries to avoid persecution from Hynkel's regime.,Charles Chaplin,"['Charles Chaplin', 'Paulette Goddard', 'Jack Oakie', 'Reginald Gardiner']"
85,Tengoku to jigoku,1963,143,8.4,90,"48,536",#86,An executive of a Yokohama shoe company becomes a victim of extortion when his chauffeur's son is kidnapped by mistake and held for ransom.,Akira Kurosawa,"['Toshirô Mifune', 'Yutaka Sada', 'Tatsuya Nakadai', 'Kyôko Kagawa']"
86,Kaithi,2019,145,8.4,NO Score,"36,745",No count,"Dilli, an ex-convict, endeavours to meet his daughter for the first time after leaving prison. However, his attempts are interrupted due to a drug raid planned by Inspector Bejoy.",Lokesh Kanagaraj,"['Karthi', 'Narain', 'Arjun Das', 'George Maryan']"
87,Sardar Udham,2021,164,8.4,NO Score,"44,557",No count,"A biopic detailing the 2 decades that Punjabi Sikh revolutionary, Udham Singh, spent planning the assassination of the man responsible for the Jallianwala Bagh massacre.",Shoojit Sircar,"['Vicky Kaushal', 'Shaun Scott', 'Stephen Hogan', 'Amol Parashar']"
88,Asuran,2019,141,8.4,NO Score,"31,514",No count,"The teenage son of a farmer from an underprivileged caste kills a rich, upper caste landlord. How the pacifist farmer saves his hot-blooded son is the rest of the story.",Vetrimaaran,"['Dhanush', 'Manju Warrier', 'Prakash Raj', 'Pasupathy']"
89,Drishyam 2,2021,152,8.4,NO Score,"39,282",No count,A gripping tale of an investigation and a family which is threatened by it. Will Georgekutty be able to protect his family this time?,Jeethu Joseph,"['Mohanlal', 'Meena', 'Ansiba', 'Esther Anil']"
90,Top Gun: Maverick,2022,130,8.3,78,"608,518",$718.73M,"After thirty years, Maverick is still pushing the envelope as a top naval aviator, but must confront ghosts of his past when he leads TOP GUN's elite graduates on a mission that demands the ultimate sacrifice from those chosen to fly it.",Joseph Kosinski,"['Tom Cruise', 'Jennifer Connelly', 'Miles Teller', 'Val Kilmer']"
91,Inglourious Basterds,2009,153,8.3,69,"1,503,625",$120.54M,"In Nazi-occupied France during World War II, a plan to assassinate Nazi leaders by a group of Jewish U.S. soldiers coincides with a theatre owner's vengeful plans for the same.",Quentin Tarantino,"['Brad Pitt', 'Diane Kruger', 'Eli Roth', 'Mélanie Laurent']"
92,Heat,1995,170,8.3,76,"682,807",$67.44M,A group of high-end professional thieves start to feel the heat from the LAPD when they unknowingly leave a clue at their latest heist.,Michael Mann,"['Al Pacino', 'Robert De Niro', 'Val Kilmer', 'Jon Voight']"
93,American Beauty,1999,122,8.3,84,"1,178,135",$130.10M,A sexually frustrated suburban father has a mid-life crisis after becoming infatuated with his daughter's best friend.,Sam Mendes,"['Kevin Spacey', 'Annette Bening', 'Thora Birch', 'Wes Bentley']"
94,Requiem for a Dream,2000,102,8.3,71,"866,457",$3.64M,The drug-induced utopias of four Coney Island people are shattered when their addictions run deep.,Darren Aronofsky,"['Ellen Burstyn', 'Jared Leto', 'Jennifer Connelly', 'Marlon Wayans']"
95,Good Will Hunting,1997,126,8.3,70,"1,011,011",$138.43M,"Will Hunting, a janitor at M.I.T., has a gift for mathematics, but needs help from a psychologist to find direction in his life.",Gus Van Sant,"['Robin Williams', 'Matt Damon', 'Ben Affleck', 'Stellan Skarsgård']"
96,Hamilton,2020,160,8.3,89,"103,313",#108,"The real life of one of America's foremost founding fathers and first Secretary of the Treasury, Alexander Hamilton. Captured live on Broadway from the Richard Rodgers Theater with the original Broadway cast.",Thomas Kail,"['Lin-Manuel Miranda', 'Phillipa Soo', 'Leslie Odom Jr.', 'Renée Elise Goldsberry']"
97,Scarface,1983,170,8.3,65,"873,037",$45.60M,"In 1980 Miami, a determined Cuban immigrant takes over a drug cartel and succumbs to greed.",Brian De Palma,"['Al Pacino', 'Michelle Pfeiffer', 'Steven Bauer', 'Mary Elizabeth Mastrantonio']"
98,Eternal Sunshine of the Spotless Mind,2004,108,8.3,89,"1,037,023",$34.40M,"When their relationship turns sour, a couple undergoes a medical procedure to have each other erased from their memories for ever.",Michel Gondry,"['Jim Carrey', 'Kate Winslet', 'Tom Wilkinson', 'Gerry Robert Byrne']"
99,Braveheart,1995,178,8.3,68,"1,060,405",$75.60M,Scottish warrior William Wallace leads his countrymen in a rebellion to free his homeland from the tyranny of King Edward I of England.,Mel Gibson,"['Mel Gibson', 'Sophie Marceau', 'Patrick McGoohan', 'Angus Macfadyen']"
